byline,headline
,Trump Retreating After Border Policy Outcry
By MAGGIE HABERMAN and MICHAEL D. SHEAR 12:42 PM ET,"Families Would Be Detained Together, Not Separated"
By KIRK SEMPLE 2:15 PM ET,"On Mexico’s Migrant Trail, Trump Policy Means Tough Choices"
,Authorities Open ‘Tender Age’ Shelters for Young Children
,"Evangelical Leaders Lament Separations, but Still Stand Behind Trump"
,A Troubling Prognosis for Migrant Children in Detention
,
By ELIZABETH WILLIAMSON and RON NIXON 9:05 AM ET,"Once a Target of Trump’s Rage, Now She Protects Him"
By MICHAEL CORKERY 10:55 AM ET,Walmart ‘Surprised’ Store Is a Shelter. There Were Hints.
By LIZ ROBBINS 1:40 PM ET,Children Taken at the Border Arrive in New York
By EDUARDO PORTER and KARL RUSSELL,Immigration Myths and Global Realities
By ALEXANDER BURNS 2:17 PM ET,Bloomberg to Back House Democrats With $80 Million
By KATIE ROGERS and KENNETH P. VOGEL 1:04 PM ET,"Outside Trump Hotel, Tumult. Inside, a Sea of Conservative Cash."
By JONATHAN MAHLER,A Conservative Think Tank Stocks the Trump Government
By ELISABETH MALKIN 10:12 AM ET,At Ground Zero in Nicaragua’s Bloody War to End Protests
By SARA JERVING,Veterans End Up in Debt Over Survivor Benefit Charges
By SABRINA TAVERNISE,More Deaths Than Births Among Whites in Many U.S. States
By LAURIE GOODSTEIN 1:02 PM ET,Cardinal Accused of Abuse Is Suspended From Ministry
By ANDREW KEH and REBECCA R. RUIZ 10:06 AM ET,Infamous Russian Drug-Testing Lab Is Now a Gastro Pub
,Live Updates and Analysis: Spain vs. Iran 2:55 PM ET
,"In Spain and Iran, Two Coaches Wise in the Ways It Can Go 1:38 PM ET"
By THE NEW YORK TIMES,"1,600 Degrees and Mass Destruction: Explore a Town a Volcano Made a Tomb"
By CHRIS STANFORD 12:54 PM ET,Your Wednesday Briefing
By ADAM NAGOURNEY and MATT STEVENS,California Today: Garcetti Not a Fan of the Jungle Primary
,Listen to ‘The Daily’: Forced Apart
,Listen to ‘The Daily’: Forced Apart
By ANN CARRNS,Hurricane Season Has Begun. Do You Need Flood Insurance?
,Graduation Gift Ideas
,
By JEFFREY GETTLEMAN,Where a Taboo Leads to the Deaths of Young Women
By RUTH LA FERLA 1:27 PM ET,The Glamorous Grandmas of Instagram
By HILARIE M. SHEETS,Warhol at the Whitney: From Myth to Man
By RONI CARYN RABIN 2:05 PM ET,A Study on Drinking That They Wanted to Call ‘Cheers’
By JIM DWYER,Giuliani Promised a Surprise. Comey Delivered One.
,"Amazon, Berkshire Hathaway and JPMorgan Name Health C.E.O."
,Disney Raises Offer for 21st Century Fox in Bidding War
,"Investigators Questioned Giuliani in Leak Inquiry, He Says"
,U.S. Judge Criticizes F.B.I. Over Dylann Roof’s Gun Purchase
By THE NEW YORK TIMES,9 Ways to Get the Most Out of Your Times Subscription
,It’s Almost Summer. Finally.
,Gender Letter
,Australia’s Anxiety About World Affairs
,When Texans Try Vegemite
,Huawei’s New Front in the Global Technology Cold War: Australia
,"In Venice, a Biennale Show About Hooking Up"
,Photographing Ordinary Life in Passing
,"With New Album, Dawes Is Unlocking Its Future"
By JEANINE CUMMINS,"‘If It Could Happen to Them, Why Can’t It Happen to Us?’"
By RICHARD PARKER 12:40 PM ET,American Internment Camps
,Bruni: Donald Trump’s Small Hostages
,The Dystopia Is Here
,Beyond Trump’s Korea Fantasies
,"If You Want to Be Speaker, Mr. Crowley, Don’t Take Voters for Granted"
By ALEXEY KOVALEV 1:43 PM ET,The World Cup Is Fun. Except for the Russians Being Tortured.
,Sign Up for Our World Cup Newsletter »
,Douthat: The Handmaids of Capitalism 9:54 AM ET
,Friedman: Trump to Dictators: Have a Nice Day
,Leonhardt: The Two Biggest Problems With College
,The Illuminations of Hannah Arendt 11:00 AM ET
,I Am Running for President in Turkey. From Prison.
,Why the U.S. Should Drop All Tariffs
,Meet the Woman Who ‘Really Runs’ the New York Times Newsroom
,We Want to Hear From You
,Play Today’s Puzzle
,Meet the Woman Who ‘Really Runs’ the New York Times Newsroom
,Play Today’s Puzzle
,Play Today’s Puzzle
,
,
,Review: Waiting for Po-Po in a Searing ‘Pass Over’
,The Best Way to Fix Gerrymandering
,The Elephant’s Superb Nose
,What Kind of Art Does an Artist Like?
,How Trickle-Down Economics Won the Colombian Election
,Dr. Adel Mahmoud Dies; Credited With Vaccines
,On Mexico’s Migrant Trail: Confusion and Tough Choices
,Hungary Passes ‘Stop Soros’ Law Criminalizing Aid to Migrants
,"As Kim Ends Beijing Visit, China and North Korea Craft New Messages"
,Immigration Myths and Global Realities
,Walmart ‘Surprised’ Old Store Is a Migrant Shelter. Records Hinted at the Possibility.
,Disney Raises Offer for 21st Century Fox in Bidding War With Comcast
,American Internment Camps
,"‘If It Could Happen to Them, Why Can’t It Happen to Us?’"
,Ross Douthat: The Handmaids of Capitalism
,Where Trump’s ‘Zero Tolerance’ Immigration Policy Began
,Kirstjen Nielsen Is Confronted by Protesters at Mexican Restaurant: ‘Shame!’
,What’s Behind the ‘Tender Age’ Shelters Opening for Young Migrants
,State of the Art: How Tech Companies Conquered America’s Cities
,"Microsoft Employees Protest Work With ICE, as Tech Industry Mobilizes Over Immigration"
,IBM Unveils System That ‘Debates’ With Humans
,Josh Brolin Fears the Summer of Josh Brolin
,"In Venice, Center of Cruising, a Biennale Show About Hooking Up"
,Dawes Has Been Tied to the Past. The Band’s New Album Unlocks Its Future.
,"Steve Schmidt, Longtime G.O.P. Strategist, Quits ‘Corrupt’ and ‘Immoral’ Party"
,Michael Bloomberg Will Spend $80 Million on the Midterms. His Goal: Flip the House.
,Trump Plans Executive Order to Allow Detaining Families Together Indefinitely
,The Glamorous Grandmas of Instagram
,Skin Deep: The Wellness World’s Buzzy New Best Friend
,Missed the Latest Supreme Drop? Head to Grailed
,Josh Brolin Fears the Summer of Josh Brolin
,Kevin Spacey Film to Hit Theaters Despite Sexual Misconduct Accusations
,‘Incredibles 2’ Moviegoers Warned About Possible Seizures
,Children Taken at the Border Arrive in New York
,American Cardinal Accused of Sexually Abusing Minor Is Suspended From Ministry
,Marijuana in New York: Here’s How the Laws Are Changing
,One Magic Ronaldo Moment Is All Portugal Needs vs. Morocco
,World Cup 2018: Spain vs. Iran Live Updates
,The Infamous Sochi Drug-Testing Lab Is Now a Gastro Pub
,Falling for the Lure of the Stage. The Backstage.
,"Review: ‘Sugar in Our Wounds’ May Make You Cry About the Past, and the Present"
,Review: A Cool-Tempered ‘Othello’ for Warm Central Park Nights
,ScienceTake: The Elephant’s Superb Nose
,Trilobites: Sea Stars Started Dissolving. What Helped Some of Them Survive?
,Mammals Go Nocturnal in Bid to Avoid Humans
,"Peter Thomson, 88, Australian Golfer With 5 British Open Wins, Dies"
,"Bonaldo Giaiotti, Stalwart Operatic Bass, Dies at 85"
,"Matt Murphy, Master of Blues Guitar, Is Dead at 88"
,Fox News Faces Criticism of Family Separation Coverage From Inside Murdoch Empire
,The First Time: Betty Gilpin: The First Time I Bought a Crumbling 1834 Farmhouse
,Best of Late Night: Colbert Says Sanders Can’t Hide From Trump’s Immigration Policies
,"Amazon, Berkshire Hathaway and JPMorgan Name C.E.O. for Health Initiative"
,"A Troubling Prognosis for Migrant Children in Detention: ‘The Earlier They’re Out, the Better’"
,"Global Health: Nearly Eradicated in Humans, the Guinea Worm Finds New Victims: Dogs"
,"Explorer: On a Canoe Trip Along the U.S.-Canada Border, Solitude and Shooting Stars"
,"5 Places: Five Places to Go in Bantam, Conn."
,"The 52 Places Traveler: Place 18 of 52: From Refugees to a Reunion, Buffalo Lives Up to Its Welcoming Reputation"
,Books of The Times: Seeing the Art World Through Personal and Political Lenses
,Books of The Times: Sonnets That Reckon With Donald Trump’s America
,Applied Reading: Harry Potter in Your Pocket
,Colleges and State Laws Are Clamping Down on Fraternities
,"In the Age of Trump, Civics Courses Make a Comeback"
,Colleges Grapple With Where — or Whether — to Draw the Line on Free Speech
,Discovering the Art of Craft
,Restaurant Review: Legacy Records Looks for History in a Brand New Neighborhood
,Osteria Francescana Tops World’s 50 Best Restaurants List
,Doctors Don’t Know Why This Teenager Can’t Keep Down Food and Drink. Can You Help?
,Feature: How One Conservative Think Tank Is Stocking Trump’s Government
,At War: Veterans Owe Thousands for Survivor Benefits. Why Can’t They Opt Out?
,International Real Estate: House Hunting in … Hungary
,"What You Get: $250,000 Homes in Vermont, Virginia and New York"
,"Living In: Upper Saddle River, N.J.: Quiet and Neat as a Pin"
,Congress Is Writing Lots of Opioid Bills. But Which Ones Will Actually Help?
,The New Health Care: Why the Medical Research Grant System Could Be Costing Us Great Ideas
,Trade Skirmish or War? Who Gets Hurt?
,"After Volcano Eruption in Guatemala, Re-creating a Truck Covered in Ash"
,Meet the Woman Who ‘Really Runs’ the New York Times Newsroom
,"Writing About Earthquakes, and Feeling One"
,Elon Musk Accuses Tesla Employee of Sabotage
,"Wheels: When Cars Do the Driving, Who Will Feel the Joy?"
,"Ford Aims to Revive a Detroit Train Station, and Itself"
,Meet an Artist Who Matches His Suit to His Couch
,T Agitprop: 13 Artists On: Immigration
,How an Art Dealer Became an Up-and-Coming Painter
By ROXANA POPESCU 9:30 AM ET,House Hunting in … Hungary
,Search for Homes for Sale or Rent
,Mortgage Calculator
